<!ELEMENT selectors (selector*)>
	
<!ELEMENT selector (queue|selector)*>
<!ATTLIST selector
	name CDATA #REQUIRED
	type CDATA #REQUIRED
	probability CDATA #IMPLIED
	frequency CDATA #IMPLIED>

<!ELEMENT queue EMPTY>
<!ATTLIST queue
	name CDATA #REQUIRED
	probability CDATA #IMPLIED
	frequency CDATA #IMPLIED>

